{
  "$schema": "https://json-schema.org/draft/2020-12/schema",
  "$id": "https://github.com/Moonrend/acp-registry/schema/agent.schema.json",
  "title": "ACP agent declaration",
  "description": "One file per ACP agent. Declares everything a host needs to build the image, launch the adapter, and persist its credentials. Hosts must not carry per-agent knowledge outside this file.",
  "type": "object",
  "required": [
    "id",
    "name",
    "version",
    "dist",
    "storage"
  ],
  "additionalProperties": false,
  "properties": {
    "id": {
      "type": "string",
      "pattern": "^[a-z0-9][a-z0-9-]*$",
      "description": "Registry id. Also the image name: ghcr.io/moonrend/acp-registry/<id>."
    },
    "name": {
      "type": "string",
      "description": "Human-readable display name."
    },
    "version": {
      "type": "string",
      "description": "Upstream version pinned by this declaration."
    },
    "homepage": {
      "type": "string"
    },
    "description": {
      "type": "string"
    },
    "profileId": {
      "type": "string",
      "description": "Stable host-side profile id. Replaces the host's hardcoded profile->registry map."
    },
    "dist": {
      "type": "object",
      "description": "How to install the adapter into the image.",
      "required": [
        "kind"
      ],
      "additionalProperties": false,
      "properties": {
        "kind": {
          "enum": [
            "npx",
            "uvx",
            "binary"
          ]
        },
        "package": {
          "type": "string",
          "description": "npx/uvx package spec, e.g. name@1.2.3."
        },
        "archive": {
          "type": "string",
          "description": "binary: download URL."
        },
        "sha256": {
          "type": "string",
          "description": "binary: checksum, verified at build time."
        },
        "cmd": {
          "type": "string",
          "description": "Executable name inside the archive."
        },
        "args": {
          "type": "array",
          "items": {
            "type": "string"
          },
          "default": []
        },
        "env": {
          "type": "object",
          "additionalProperties": {
            "type": "string"
          },
          "default": {}
        },
        "constraints": {
          "type": "array",
          "items": {
            "type": "string"
          },
          "description": "uvx: pins for transitive deps upstream left unbounded, e.g. \"agent-client-protocol==0.8.1\". Needed when a breaking release of a shared library would otherwise break an already-pinned adapter.",
          "default": []
        }
      }
    },
    "storage": {
      "type": "object",
      "description": "Unified credential/config persistence contract. Replaces per-agent branches in the host.",
      "required": [
        "mode"
      ],
      "additionalProperties": false,
      "properties": {
        "mode": {
          "enum": [
            "home",
            "state-home",
            "files",
            "none"
          ],
          "description": "home: persist whole $HOME. state-home: persist $HOME under a state dir with XDG vars. files: persist an explicit file list. none: stateless."
        },
        "env": {
          "type": "object",
          "additionalProperties": {
            "type": "string"
          },
          "description": "Extra env for the adapter process. ${STATE_DIR}/${RUNTIME_DIR}/${HOME_DIR} are expanded by the host."
        },
        "xdg": {
          "type": "boolean",
          "default": false,
          "description": "Set XDG_CONFIG_HOME/XDG_DATA_HOME under the persisted home."
        },
        "artifacts": {
          "type": "array",
          "description": "mode=files: explicit durable<->runtime file mappings.",
          "items": {
            "type": "object",
            "required": [
              "durable",
              "runtime"
            ],
            "additionalProperties": false,
            "properties": {
              "durable": {
                "type": "string",
                "description": "Path relative to the durable root."
              },
              "runtime": {
                "type": "string",
                "description": "Path relative to the runtime state dir."
              },
              "sync": {
                "enum": [
                  "none",
                  "exit",
                  "codex_auth"
                ],
                "default": "exit",
                "description": "When to copy the runtime copy back to durable storage."
              },
              "when": {
                "type": "array",
                "items": {
                  "enum": [
                    "self",
                    "oauth",
                    "api_key"
                  ]
                },
                "description": "Only apply this artifact for these setup modes. Omit for all modes."
              }
            }
          }
        }
      }
    },
    "auth": {
      "type": "object",
      "description": "Which setup flows this agent supports, so the UI can render them generically.",
      "additionalProperties": false,
      "properties": {
        "modes": {
          "type": "array",
          "items": {
            "enum": [
              "self",
              "oauth",
              "api_key"
            ]
          },
          "default": [
            "self"
          ]
        },
        "apiKeyEnv": {
          "type": "array",
          "items": {
            "type": "string"
          },
          "description": "Env var names accepted for api_key mode."
        },
        "noBrowserEnv": {
          "type": "object",
          "additionalProperties": {
            "type": "string"
          },
          "description": "Env applied during oauth to force device-code instead of opening a browser."
        }
      }
    },
    "smoke": {
      "type": "object",
      "description": "Build-time smoke test tuning. A few agents hard-require credentials before they will handshake; for those the build still proves the binary installed, launched and reported a recognisable login prompt.",
      "additionalProperties": false,
      "properties": {
        "loginRequiredPattern": {
          "type": "string",
          "description": "Regex (JS syntax). When the agent answers `initialize` with a JSON-RPC error, or exits early, and the error message / stderr matches this pattern, the smoke test passes as 'login required'. Anything else — malformed output, an unrecognised crash, or silence — still fails. Keep the pattern narrow so real breakage is not masked."
        }
      }
    },
    "integration": {
      "type": "object",
      "description": "How Zakura wires this agent up. Ships with the registry so the host needs no per-agent code.",
      "additionalProperties": false,
      "properties": {
        "zakuraRoute": {
          "type": "boolean",
          "default": false,
          "description": "Agent can be pointed at Zakura's own model gateway."
        },
        "modelPrefix": {
          "type": "string",
          "description": "Prefix prepended to model ids when routed through Zakura (e.g. 'zakura/'). Only meaningful with zakuraRoute."
        },
        "sessionModeId": {
          "type": "string",
          "description": "ACP session mode id to request on session/new."
        },
        "forceHttpMcp": {
          "type": "boolean",
          "default": false,
          "description": "Agent only speaks HTTP MCP; never hand it a stdio gateway."
        },
        "preinstalled": {
          "type": "boolean",
          "default": false,
          "description": "Binary already exists in the image; skip any install step."
        },
        "installHint": {
          "type": "string",
          "description": "Human-facing hint shown when setup needs manual action."
        },
        "dotenv": {
          "type": "object",
          "additionalProperties": {
            "type": "string"
          },
          "description": "Files written into the adapter home before launch; values may use ${VAR} placeholders."
        }
      }
    }
  }
}
