{
  "id": "junie",
  "name": "Junie",
  "version": "3893.6.0",
  "profileId": "junie",
  "dist": {
    "kind": "binary",
    "archive": "https://github.com/JetBrains/junie-acp-release/releases/download/3893.6/junie-release-3893.6-linux-amd64.zip",
    "sha256": "dc88c2434c4d673d4df1fe579cfaaf34565b223c6a8702c6ee8e0494638f8635",
    "cmd": "./junie-app/bin/junie",
    "args": [
      "--acp=true"
    ]
  },
  "storage": {
    "mode": "files",
    "env": {
      "HOME": "${RUNTIME_DIR}"
    },
    "artifacts": [
      {
        "durable": ".credentials.json",
        "runtime": ".credentials.json",
        "sync": "exit",
        "when": [
          "self"
        ]
      }
    ]
  },
  "auth": {
    "modes": [
      "self"
    ]
  }
}
