{
  "id": "mistral-vibe",
  "name": "Mistral Vibe",
  "version": "3.0.1",
  "profileId": "mistral-vibe",
  "dist": {
    "kind": "binary",
    "archive": "https://github.com/mistralai/mistral-vibe/releases/download/v3.0.1/vibe-acp-linux-x86_64-3.0.1.tar.gz",
    "sha256": "0771544f32f64132731e3d40ca1fdfa628c6076dae1ad4d273fdc31562a13062",
    "cmd": "./vibe-acp"
  },
  "storage": {
    "mode": "files",
    "env": {
      "HOME": "${RUNTIME_DIR}"
    },
    "artifacts": [
      {
        "durable": ".credentials.json",
        "runtime": ".credentials.json",
        "sync": "exit",
        "when": [
          "self"
        ]
      }
    ]
  },
  "auth": {
    "modes": [
      "self",
      "api_key"
    ]
  }
}
