{
  "id": "poolside",
  "name": "Poolside",
  "version": "1.0.16",
  "profileId": "poolside",
  "dist": {
    "kind": "binary",
    "archive": "https://downloads.poolside.ai/pool/v1.0.16/pool-linux-amd64.tar.gz",
    "sha256": "e86aa8c9feef003540673ab494e91bfadc273218d531c43d662cafb69e464146",
    "cmd": "./pool-linux-amd64",
    "args": [
      "acp"
    ]
  },
  "storage": {
    "mode": "files",
    "env": {
      "HOME": "${RUNTIME_DIR}"
    },
    "artifacts": [
      {
        "durable": ".credentials.json",
        "runtime": ".credentials.json",
        "sync": "exit",
        "when": [
          "self"
        ]
      }
    ]
  },
  "auth": {
    "modes": [
      "self",
      "api_key"
    ]
  }
}
