{
  "id": "deepagents",
  "name": "DeepAgents",
  "version": "0.1.7",
  "profileId": "deepagents",
  "dist": {
    "kind": "npx",
    "package": "deepagents-acp@0.1.7"
  },
  "storage": {
    "mode": "files",
    "env": {
      "HOME": "${RUNTIME_DIR}"
    },
    "artifacts": [
      {
        "durable": ".credentials.json",
        "runtime": ".credentials.json",
        "sync": "exit",
        "when": [
          "self"
        ]
      }
    ]
  },
  "auth": {
    "modes": [
      "self",
      "api_key"
    ]
  },
  "integration": {
    "zakuraRoute": true
  }
}
