{
  "id": "antigravity-acp",
  "name": "Google Antigravity",
  "version": "1.4.5",
  "profileId": "antigravity-acp",
  "dist": {
    "kind": "binary",
    "archive": "https://dl.google.com/agy-extensions/releases/linux/agy-acp-server-1.4.5-linux-x86_64.zip",
    "sha256": "923923a0d7dc8073f66cc6f78647a3107e3a7ee2b7e1a24df8b3927b5188013b",
    "cmd": "./agy_acp_server.par",
    "args": [
      "--uid="
    ]
  },
  "storage": {
    "mode": "files",
    "env": {
      "HOME": "${RUNTIME_DIR}"
    },
    "artifacts": [
      {
        "durable": ".credentials.json",
        "runtime": ".credentials.json",
        "sync": "exit",
        "when": [
          "self"
        ]
      }
    ]
  },
  "auth": {
    "modes": [
      "self",
      "api_key"
    ]
  }
}
