{
  "id": "fx-acp",
  "name": "fx",
  "version": "0.0.7",
  "profileId": "fx",
  "homepage": "https://fx.sh",
  "description": "fx CLI\uff08fx acp\uff09\u2014 Vercel AI Gateway \u9a71\u52a8\u7684\u7f16\u7801\u4ee3\u7406",
  "dist": {
    "kind": "binary",
    "archive": "https://releases.fx.sh/v0.0.7/fx-linux-x86_64.tar.gz",
    "sha256": "c5787ea041d3b5521ec675f1ada78f30cf1b11021ffcac48b4969cf5beb65c45",
    "cmd": "fx",
    "args": [
      "acp"
    ]
  },
  "storage": {
    "mode": "files",
    "env": {
      "HOME": "${HOME_DIR}"
    },
    "artifacts": [
      {
        "durable": ".fx",
        "runtime": ".fx",
        "sync": "exit",
        "when": [
          "self",
          "oauth"
        ]
      }
    ]
  },
  "auth": {
    "modes": [
      "self",
      "oauth",
      "api_key"
    ]
  },
  "smoke": {
    "loginRequiredPattern": "fx needs access to Vercel AI Gateway|Run fx login to sign in"
  },
  "integration": {
    "preinstalled": true,
    "zakuraRoute": true
  }
}
