{
  "id": "harn",
  "name": "Harn",
  "version": "0.10.167",
  "profileId": "harn",
  "dist": {
    "kind": "binary",
    "archive": "https://github.com/burin-labs/harn/releases/download/v0.10.167/harn-x86_64-unknown-linux-gnu.tar.gz",
    "sha256": "dbb02db958f9ba21caa74f3ecda8a98bfcd344fe997da1b15d3befee4be560ac",
    "cmd": "./harn",
    "args": [
      "serve",
      "acp"
    ]
  },
  "storage": {
    "mode": "files",
    "env": {
      "HOME": "${RUNTIME_DIR}"
    },
    "artifacts": [
      {
        "durable": ".credentials.json",
        "runtime": ".credentials.json",
        "sync": "exit",
        "when": [
          "self"
        ]
      }
    ]
  },
  "auth": {
    "modes": [
      "self",
      "api_key"
    ]
  }
}
