{
  "id": "amp-acp",
  "name": "Amp",
  "version": "0.10.0",
  "profileId": "amp",
  "dist": {
    "kind": "binary",
    "archive": "https://github.com/tao12345666333/amp-acp/releases/download/v0.10.0/amp-acp-linux-x86_64.tar.gz",
    "sha256": "320959bb1de650681413a3fc72febd62fded65c734b9ab3399855e007fcdd1ba",
    "cmd": "./amp-acp"
  },
  "storage": {
    "mode": "files",
    "env": {
      "HOME": "${RUNTIME_DIR}"
    },
    "artifacts": [
      {
        "durable": ".credentials.json",
        "runtime": ".credentials.json",
        "sync": "exit",
        "when": [
          "self"
        ]
      }
    ]
  },
  "auth": {
    "modes": [
      "self",
      "api_key"
    ]
  }
}
